### ISSUE TITLE
Expect: 100-continue multi curl problem with Gunicorn

### ISSUE THREAD

**Issue by khrizt** [getsentry/raven-php#216]
Hi,

We are trying the new sentry 7 version (we are currently in 7.1.4) and we ran into some problems while logging messages from PHP. With the migration to sentry 7 and the change to http protocol in sentry we switched to async mode in Raven so having 1 sentry server would not be a bottleneck problem for our 20-server platform.

The problem we are facing is that some messages get to sentry and some others don't and putting a sniffer to check if the message was being sent we found this:

```
server.41304 > sentry-server.http: Flags [P.], cksum 0xd93d (incorrect -> 0x050e), seq 0:387, ack 1, win 115, options [nop,nop,TS val 1945893044 ecr 1015529530], length 387
E.....@.@.......
....X.P..S....P...s.=.....
s...<..:POST /api/36/store/ HTTP/1.1
Host: sentry-server
Accept: */*
User-Agent: raven-php/0.11.0
X-Sentry-Auth: Sentry sentry_timestamp=1432042202.261651, sentry_client=raven-php/0.11.0, sentry_version=5, sentry_key=[sentry_key], sentry_secret=[sentry_secret]
Content-Type: application/octet-stream
Content-Length: 3448
Expect: 100-continue
```

And it looks like the server does not respond and raven does not send the next message. But on some other messages we get this:

```
server.41150 > sentry-server.http: Flags [P.], cksum 0xd93d (incorrect -> 0xb36a), seq 0:387, ack 1, win 115, options [nop,nop,TS val 1945857646 ecr 1015494134], length 387
E.....@.@.Z.....
......P\?h.l`.C...s.=.....
s.nn<.5.POST /api/36/store/ HTTP/1.1
Host: sentry-server
Accept: */*
User-Agent: raven-php/0.11.0
X-Sentry-Auth: Sentry sentry_timestamp=1432042060.666881, sentry_client=raven-php/0.11.0, sentry_version=5, sentry_key=[sentry_key], sentry_secret=[sentry_secret]
Content-Type: application/octet-stream
Content-Length: 1612
Expect: 100-continue


15:27:40.680485 IP (tos 0x0, ttl 64, id 1733, offset 0, flags [DF], proto TCP (6), length 52)
    server.41150 > sentry-server.http: Flags [.], cksum 0xd7ba (incorrect -> 0x6093), seq 387, ack 26, win 115, options [nop,nop,TS val 1945857646 ecr 1015494135], length 0
E..4..@.@.\k....
......P\?j0l`.\...s.......
s.nn<.5.
15:27:40.722371 IP (tos 0x0, ttl 64, id 44060, offset 0, flags [DF], proto TCP (6), length 60)
    server.41151 > sentry-server.http: Flags [S], cksum 0xd7c2 (incorrect -> 0x37e7), seq 3113402981, win 14600, options [mss 1460,sackOK,TS val 1945857657 ecr 0,nop,wscale 7], length 0
E..<..@.@.......
......P...e......9............
s.ny........
15:27:40.722771 IP (tos 0x0, ttl 64, id 1734, offset 0, flags [DF], proto TCP (6), length 1500)
    server.41150 > sentry-server.http: Flags [.], cksum 0xdd62 (incorrect -> 0xf569), seq 387:1835, ack 26, win 115, options [nop,nop,TS val 1945857657 ecr 1015494135], length 1448
E.....@.@.V.....
......P\?j0l`.\...s.b.....
s.ny<.5.eJy1Vgtvm0gQ/isrpEZ92Lz8duq7IzZOLNnGB/jaXKnQGm8wCSxkWZy0Uf/7zYLtRElbpadGQgjmvfPNzsydlBPK2Rc5opywCxyQXD7jPJP6d1JC+CZdS33p1HSlmlSwGL43wOx7iqfgIEgLynOZs3QbcTlIEznYsCjnEabymmxJ7Cl/Bul6kKdBhGM/TsOIHoGVgbDxqmG80sfw3NzcPDBxFGMaFjgkA5L7pnOUCc6asEGYpmFMIIzrgrAvfs5ZREOI5/c7CNL0KiK5yIAfYnF8Q5N1ud3qtlSt0erIWlNr9+DV00F6cbZwTMeZjECQqZ1LVWO8rfVWvc1l2mX8uhNeXRa69K0mbQgGP6XdszTnIP+MFIKHZU5Y3QgBJlCZpV+jOMae0pJV9HqGA8AtzTfHaAL4xQgIyHLQR6SpcucYsW2/0ZbVN+iUBFepp+iqpsKjoXHEyEV66ymCXf7BOTwFlOQmuDSCgGTCHSe33FM2PIlrOMviKMA8Sqmn3ArSu9sn5CQ+vh6ocq/21lPelp/dg7n6dJd5sEtofenUCC1FWvciJgU8K2DDr1FWQ2tyEWMuYBmWsAADQBn8GJJjdEBk8BM8atLH+oTmUbipgODRdu+GUhKI4wD9ipCsjuNoW3JwsCF14ANa4iYk+LYu6kgV4BK6FcA6Q3uycP2lPQUBTwGtA2Xyy5dHVJfhnpWWipx5SpwGGOiriPZ3lOoT3sKTaf9j2r4zOZ0b7tI2Qe89Xq8ZyfM/jEwEDwUAWdN19HpEVuDoDXII2xKGMEfPiAgtUsZRV30P8e/seg8dW2P3g1H6/YG7e9m5MTOffQF2OsZoZIMOYCxr7a6sQQXovXv2wrJdYHdVINnmzHLNJxqqrDXawB5Zw+XMnLu+bVlumd4thmRCo/CUg3tP2QVFCZALCkXAchzXyy4DwmRV4bsPbjaZgykgJziHVvrXz49UVcV4MjV3qfjfMUR0TW7lbJPdn3uXilan1e0A9dRwzQ/GuT+Zu6Y9NobC3fB04imarD3In2251tAShXvmuos91zb/XpqO689M98waHYYBEO1z33Htyfz0Rbrw3m91cV5kkuxAOADwMJPQRHzHnI6fMPZxuZOZ6Y+nliEyrTUbutrU1bZaa2utR1JS/579DVpFXt45n+JEdLMNjlNe5KADAV5C5wFaWaR5xMmzrwhkJCQMxA81UiUJWByH5cxZpwmO6K83IYg4gxZ8kbIElKskxKXbvrQmqyKEf5gSDAsnhw84DKwSuR/B/tDQG71ODdaJJIXJnRF85Rd5NQf0mt5CsxPpwH3KqNaOFymAKPtedxAm/Ue7T4XZs+GA4UoYKxVoEQvKRRST591yRmKCc5J/575XncVTdjMoBqanOGVKpkJiV6JxRMGXpsMqE+McwJfc0r7nLfcWS3HPe2jIe2BIBFzQ/RRkBZVE4SYAaIXO
15:27:40.722789 IP (tos 0x0, ttl 64, id 1735, offset 0, flags [DF], proto TCP (6), length 216)
    server.41150 > sentry-server.http: Flags [P.], cksum 0xd85e (incorrect -> 0xc6ac), seq 1835:1999, ack 26, win 115, options [nop,nop,TS val 1945857657 ecr 1015494135], length 164
E.....@.@.[.....
......P\?o.l`.\...s.^.....
s.ny<.5.p0dl9hkt7KV5YqCFYRvInCIHuqt9jobWHM0MB41MdHLumo5cpvLxvjnb2737TS4yzHAC5/70GaLmERjlOBFYw/7TqqututZztUZf7/Sb6r+ifLcQU1mqUhN2tKDXJat1r9Fsqr1V82LVbLY6naDdCcgKZv1/pJqivg==
15:27:40.723072 IP (tos 0x0, ttl 64, id 44061, offset 0, flags [DF], proto TCP (6), length 52)
```
And the message is correctly sent.

We have seen some problems with apache with that header but the thing is we are using Gunicorn from the Sentry installation. Sync mode works ok but it can be a bottleneck problem as I said before.

Any help will be appreciated

**Comment by dcramer** [comment]
Could you try master and let me know if you're still seeing the issue? This may be the long ignored bug with async (which is why we effectively had disabled it by default).

**Comment by khrizt** [comment]
Hey @dcramer thanks for the comment, would you mean try the master version of raven-php or sentry itself.

**Comment by dcramer** [comment]
@khrizt of raven-php

**Comment by khrizt** [comment]
Ok, will do and post here the results

**Comment by khrizt** [comment]
Hi @dcramer I've tested with master version of raven-php and it works ok now, but I can't use it as we have the mininum stability to stable, there's any release date plan for the current version? I can fork the current stable version and apply the commit you made in CurlHandler file until the stable version is released.

**Comment by dcramer** [comment]
We have tagged 0.12.0

**Comment by khrizt** [comment]
Wow, awesome man. Thanks a lot!
